{
  "schemaVersion": 1,
  "bucket": "example-private-bucket",
  "objectKey": "uploads/10000000-0000-0000-0000-000000000001/10000000-0000-0000-0000-000000000004",
  "versionId": "example-version-v1",
  "size": 5,
  "status": "SUCCEEDED",
  "actualSha256": "2cf24dba5fb0a30e26e83b2ac5b9e29e1b161e5c1fa7425e73043362938b9824",
  "errorCode": null,
  "processedAt": "2026-10-15T15:00:01Z"
}
